{
    "_id": "TCGA:2018-04-05_SKCM_do_aggregation",
    "_schema": "https://w3id.org/openebench/scientific-schemas/2.0/TestAction",
    "action_type": "AggregationEvent",
    "challenge_id": "TCGA:2018-04-05_SKCM",
    "dates": {
        "creation": "2018-04-05T00:00:00Z"
    },
    "involved_datasets": [
        {
            "dataset_id": "TCGA:2018-04-05_SKCM_A_TPR_MutSig2CV",
            "role": "incoming"
        },
        {
            "dataset_id": "TCGA:2018-04-05_SKCM_A_precision_MutSig2CV",
            "role": "incoming"
        },
        {
            "dataset_id": "TCGA:2018-04-05_SKCM_A_TPR_compositeDriver",
            "role": "incoming"
        },
        {
            "dataset_id": "TCGA:2018-04-05_SKCM_A_precision_compositeDriver",
            "role": "incoming"
        },
        {
            "dataset_id": "TCGA:2018-04-05_SKCM_A_TPR_2020plus",
            "role": "incoming"
        },
        {
            "dataset_id": "TCGA:2018-04-05_SKCM_A_precision_2020plus",
            "role": "incoming"
        },
        {
            "dataset_id": "TCGA:2018-04-05_SKCM_A_TPR_OncodriveFM",
            "role": "incoming"
        },
        {
            "dataset_id": "TCGA:2018-04-05_SKCM_A_precision_OncodriveFM",
            "role": "incoming"
        },
        {
            "dataset_id": "TCGA:2018-04-05_SKCM_A_TPR_ActiveDriver",
            "role": "incoming"
        },
        {
            "dataset_id": "TCGA:2018-04-05_SKCM_A_precision_ActiveDriver",
            "role": "incoming"
        },
        {
            "dataset_id": "TCGA:2018-04-05_SKCM_A_TPR_e-Driver",
            "role": "incoming"
        },
        {
            "dataset_id": "TCGA:2018-04-05_SKCM_A_precision_e-Driver",
            "role": "incoming"
        },
        {
            "dataset_id": "TCGA:2018-04-05_SKCM_A_TPR_OncodriveCLUST",
            "role": "incoming"
        },
        {
            "dataset_id": "TCGA:2018-04-05_SKCM_A_precision_OncodriveCLUST",
            "role": "incoming"
        },
        {
            "dataset_id": "TCGA:2018-04-05_SKCM_A_TPR_MuSiC",
            "role": "incoming"
        },
        {
            "dataset_id": "TCGA:2018-04-05_SKCM_A_precision_MuSiC",
            "role": "incoming"
        },
        {
            "dataset_id": "TCGA:2018-04-05_SKCM_Aggregation",
            "role": "outgoing"
        }
    ],
    "test_contact_ids": [
        "orcid:0000-0003-4526-9727",
        "orcid:0000-0001-7900-4239",
        "orcid:0000-0003-1395-5378"
    ],
    "tool_id": "TCGA:aggregate_benchmark"
}
