{
    "_id": "TCGA:2018-04-05_STAD_testEvent_MutSig2CV",
    "_schema": "https://w3id.org/openebench/scientific-schemas/2.0/TestAction",
    "action_type": "TestEvent",
    "challenge_id": "TCGA:2018-04-05_STAD",
    "dates": {
        "creation": "2018-04-05T00:00:00Z"
    },
    "involved_datasets": [
        {
            "dataset_id": "TCGA:2018-04-05_input",
            "role": "incoming"
        },
        {
            "dataset_id": "TCGA:2018-04-05_STAD_P_MutSig2CV",
            "role": "outgoing"
        }
    ],
    "test_contact_ids": [
        "orcid:0000-0003-4526-9727",
        "orcid:0000-0001-7900-4239",
        "orcid:0000-0003-1395-5378"
    ],
    "tool_id": "TCGA:MutSig2CV"
}
