{
  "_id": "CAMEO:2017-01-14_00000021_1_metrics_iddt_server20",
  "_schema": "https://w3id.org/openebench/scientific-schemas/2.0/TestAction",
  "action_type": "MetricsEvent",
  "challenge_id": "CAMEO:CAMEO-3D_2017-01-14",
  "tool_id": "CAMEO:server20",
  "involved_datasets": [
    {
      "dataset_id": "CAMEO:2017-01-14_00000021_1_M",
      "role": "incoming"
    },
    {
      "dataset_id": "CAMEO:2017-01-14_00000021_1_P_server20",
      "role": "incoming"
    },
    {
      "dataset_id": "CAMEO:2017-01-14_00000021_1_A_IDDT_server20",
      "role": "outgoing"
    }
  ],
  "dates": {
    "creation": "2017-01-14T05:30:00Z",
    "modification": "2017-01-14T05:45:00Z"
  },
  "test_contact_ids": ["orcid:0000-0002-6813-3200"]
}
