{
    "_id": "QfO:2011-07-07_G_STD_LUCA_metricsEvent_OMA-Pairs_STD_comp_trees",
    "_schema": "https://w3id.org/openebench/scientific-schemas/2.0/TestAction",
    "action_type": "MetricsEvent",
    "challenge_id": "QfO:2011-07-07_G_STD_LUCA",
    "dates": {
        "creation": "2011-07-07T00:00:00Z"
    },
    "involved_datasets": [
        {
            "dataset_id": "QfO:2011-07-07_G_STD_LUCA_M",
            "role": "incoming"
        },
        {
            "dataset_id": "QfO:2011-07-07_P_OMA-Pairs",
            "role": "incoming"
        },
        {
            "dataset_id": "QfO:2011-07-07_G_STD_LUCA_A_STD_comp_trees_OMA-Pairs",
            "role": "outgoing"
        }
    ],
    "test_contact_ids": [
        "orcid:0000-0002-2170-853X",
        "orcid:0000-0002-9074-3507",
        "orcid:0000-0003-0019-1735",
        "orcid:0000-0002-9015-5588"
    ],
    "tool_id": "QfO:OMA-Pairs"
}
