{
    "_id": "QfO:2011-07-07_TreeFam-A_do_aggregation",
    "_schema": "https://w3id.org/openebench/scientific-schemas/2.0/TestAction",
    "action_type": "AggregationEvent",
    "challenge_id": "QfO:2011-07-07_TreeFam-A",
    "dates": {
        "creation": "2011-07-07T00:00:00Z"
    },
    "involved_datasets": [
        {
            "dataset_id": "QfO:2011-07-07_TreeFam-A_A_TreeFam-A_TPR_EggNOG",
            "role": "incoming"
        },
        {
            "dataset_id": "QfO:2011-07-07_TreeFam-A_A_TreeFam-A_PPV_EggNOG",
            "role": "incoming"
        },
        {
            "dataset_id": "QfO:2011-07-07_TreeFam-A_A_TreeFam-A_TPR_EggNOG-5-Fine-grained",
            "role": "incoming"
        },
        {
            "dataset_id": "QfO:2011-07-07_TreeFam-A_A_TreeFam-A_PPV_EggNOG-5-Fine-grained",
            "role": "incoming"
        },
        {
            "dataset_id": "QfO:2011-07-07_TreeFam-A_A_TreeFam-A_TPR_EggNOG-5-Groups",
            "role": "incoming"
        },
        {
            "dataset_id": "QfO:2011-07-07_TreeFam-A_A_TreeFam-A_PPV_EggNOG-5-Groups",
            "role": "incoming"
        },
        {
            "dataset_id": "QfO:2011-07-07_TreeFam-A_A_TreeFam-A_TPR_EnsemblCompara-e56",
            "role": "incoming"
        },
        {
            "dataset_id": "QfO:2011-07-07_TreeFam-A_A_TreeFam-A_PPV_EnsemblCompara-e56",
            "role": "incoming"
        },
        {
            "dataset_id": "QfO:2011-07-07_TreeFam-A_A_TreeFam-A_TPR_EnsemblCompara-e81",
            "role": "incoming"
        },
        {
            "dataset_id": "QfO:2011-07-07_TreeFam-A_A_TreeFam-A_PPV_EnsemblCompara-e81",
            "role": "incoming"
        },
        {
            "dataset_id": "QfO:2011-07-07_TreeFam-A_A_TreeFam-A_TPR_Hieranoid2",
            "role": "incoming"
        },
        {
            "dataset_id": "QfO:2011-07-07_TreeFam-A_A_TreeFam-A_PPV_Hieranoid2",
            "role": "incoming"
        },
        {
            "dataset_id": "QfO:2011-07-07_TreeFam-A_A_TreeFam-A_TPR_InParanoid",
            "role": "incoming"
        },
        {
            "dataset_id": "QfO:2011-07-07_TreeFam-A_A_TreeFam-A_PPV_InParanoid",
            "role": "incoming"
        },
        {
            "dataset_id": "QfO:2011-07-07_TreeFam-A_A_TreeFam-A_TPR_InParanoidCore",
            "role": "incoming"
        },
        {
            "dataset_id": "QfO:2011-07-07_TreeFam-A_A_TreeFam-A_PPV_InParanoidCore",
            "role": "incoming"
        },
        {
            "dataset_id": "QfO:2011-07-07_TreeFam-A_A_TreeFam-A_TPR_OMA-GETHOGs",
            "role": "incoming"
        },
        {
            "dataset_id": "QfO:2011-07-07_TreeFam-A_A_TreeFam-A_PPV_OMA-GETHOGs",
            "role": "incoming"
        },
        {
            "dataset_id": "QfO:2011-07-07_TreeFam-A_A_TreeFam-A_TPR_GETHOGs-2.0",
            "role": "incoming"
        },
        {
            "dataset_id": "QfO:2011-07-07_TreeFam-A_A_TreeFam-A_PPV_GETHOGs-2.0",
            "role": "incoming"
        },
        {
            "dataset_id": "QfO:2011-07-07_TreeFam-A_A_TreeFam-A_TPR_OMA-Groups-RefSet5",
            "role": "incoming"
        },
        {
            "dataset_id": "QfO:2011-07-07_TreeFam-A_A_TreeFam-A_PPV_OMA-Groups-RefSet5",
            "role": "incoming"
        },
        {
            "dataset_id": "QfO:2011-07-07_TreeFam-A_A_TreeFam-A_TPR_OMA-Groups-2.0",
            "role": "incoming"
        },
        {
            "dataset_id": "QfO:2011-07-07_TreeFam-A_A_TreeFam-A_PPV_OMA-Groups-2.0",
            "role": "incoming"
        },
        {
            "dataset_id": "QfO:2011-07-07_TreeFam-A_A_TreeFam-A_TPR_OMA-Pairs-2.0",
            "role": "incoming"
        },
        {
            "dataset_id": "QfO:2011-07-07_TreeFam-A_A_TreeFam-A_PPV_OMA-Pairs-2.0",
            "role": "incoming"
        },
        {
            "dataset_id": "QfO:2011-07-07_TreeFam-A_A_TreeFam-A_TPR_OrthoFinder-2.0-BLAST",
            "role": "incoming"
        },
        {
            "dataset_id": "QfO:2011-07-07_TreeFam-A_A_TreeFam-A_PPV_OrthoFinder-2.0-BLAST",
            "role": "incoming"
        },
        {
            "dataset_id": "QfO:2011-07-07_TreeFam-A_A_TreeFam-A_TPR_OrthoFinder-2.0-DIAMOND",
            "role": "incoming"
        },
        {
            "dataset_id": "QfO:2011-07-07_TreeFam-A_A_TreeFam-A_PPV_OrthoFinder-2.0-DIAMOND",
            "role": "incoming"
        },
        {
            "dataset_id": "QfO:2011-07-07_TreeFam-A_A_TreeFam-A_TPR_OrthoFinder-2.0-MSA",
            "role": "incoming"
        },
        {
            "dataset_id": "QfO:2011-07-07_TreeFam-A_A_TreeFam-A_PPV_OrthoFinder-2.0-MSA",
            "role": "incoming"
        },
        {
            "dataset_id": "QfO:2011-07-07_TreeFam-A_A_TreeFam-A_TPR_PANTHER-LDO",
            "role": "incoming"
        },
        {
            "dataset_id": "QfO:2011-07-07_TreeFam-A_A_TreeFam-A_PPV_PANTHER-LDO",
            "role": "incoming"
        },
        {
            "dataset_id": "QfO:2011-07-07_TreeFam-A_A_TreeFam-A_TPR_PANTHER-all",
            "role": "incoming"
        },
        {
            "dataset_id": "QfO:2011-07-07_TreeFam-A_A_TreeFam-A_PPV_PANTHER-all",
            "role": "incoming"
        },
        {
            "dataset_id": "QfO:2011-07-07_TreeFam-A_A_TreeFam-A_TPR_RBH-BBH",
            "role": "incoming"
        },
        {
            "dataset_id": "QfO:2011-07-07_TreeFam-A_A_TreeFam-A_PPV_RBH-BBH",
            "role": "incoming"
        },
        {
            "dataset_id": "QfO:2011-07-07_TreeFam-A_A_TreeFam-A_TPR_RSD",
            "role": "incoming"
        },
        {
            "dataset_id": "QfO:2011-07-07_TreeFam-A_A_TreeFam-A_PPV_RSD",
            "role": "incoming"
        },
        {
            "dataset_id": "QfO:2011-07-07_TreeFam-A_A_TreeFam-A_TPR_SonicParanoid",
            "role": "incoming"
        },
        {
            "dataset_id": "QfO:2011-07-07_TreeFam-A_A_TreeFam-A_PPV_SonicParanoid",
            "role": "incoming"
        },
        {
            "dataset_id": "QfO:2011-07-07_TreeFam-A_A_TreeFam-A_TPR_SonicParanoid_fast",
            "role": "incoming"
        },
        {
            "dataset_id": "QfO:2011-07-07_TreeFam-A_A_TreeFam-A_PPV_SonicParanoid_fast",
            "role": "incoming"
        },
        {
            "dataset_id": "QfO:2011-07-07_TreeFam-A_A_TreeFam-A_TPR_SonicParanoid_sensitive",
            "role": "incoming"
        },
        {
            "dataset_id": "QfO:2011-07-07_TreeFam-A_A_TreeFam-A_PPV_SonicParanoid_sensitive",
            "role": "incoming"
        },
        {
            "dataset_id": "QfO:2011-07-07_TreeFam-A_A_TreeFam-A_TPR_MetaPhOrs",
            "role": "incoming"
        },
        {
            "dataset_id": "QfO:2011-07-07_TreeFam-A_A_TreeFam-A_PPV_MetaPhOrs",
            "role": "incoming"
        },
        {
            "dataset_id": "QfO:2011-07-07_TreeFam-A_A_TreeFam-A_TPR_Orthoinspector-1.30",
            "role": "incoming"
        },
        {
            "dataset_id": "QfO:2011-07-07_TreeFam-A_A_TreeFam-A_PPV_Orthoinspector-1.30",
            "role": "incoming"
        },
        {
            "dataset_id": "QfO:2011-07-07_TreeFam-A_A_TreeFam-A_TPR_PhylomeDB",
            "role": "incoming"
        },
        {
            "dataset_id": "QfO:2011-07-07_TreeFam-A_A_TreeFam-A_PPV_PhylomeDB",
            "role": "incoming"
        },
        {
            "dataset_id": "QfO:2011-07-07_TreeFam-A_A_TreeFam-A_TPR_OMA-Pairs",
            "role": "incoming"
        },
        {
            "dataset_id": "QfO:2011-07-07_TreeFam-A_A_TreeFam-A_PPV_OMA-Pairs",
            "role": "incoming"
        },
        {
            "dataset_id": "QfO:2011-07-07_TreeFam-A_Aggregation",
            "role": "outgoing"
        }
    ],
    "test_contact_ids": [
        "orcid:0000-0002-2170-853X",
        "orcid:0000-0002-9074-3507",
        "orcid:0000-0003-0019-1735",
        "orcid:0000-0002-9015-5588"
    ],
    "tool_id": "QfO:aggregate_benchmark"
}